{
  "dossier_id": "DEMO-VD-LAUSANNE-COMPLETE",
  "checklist_id": "PERMIT-VD-CAMAC-BASELINE",
  "project_context": {
    "country": "CH",
    "canton_or_region": "VD",
    "commune": "Lausanne",
    "phase_code": "33"
  },
  "evidence_records": [
    {
      "evidence_id": "EVID-COMPLETE-QG",
      "key": "actis_questionnaire_general",
      "kind": "platform_record",
      "title": "ACTIS-CAMAC questionnaire general ready",
      "status": "present",
      "external_ref": "ACTIS-CAMAC ready draft",
      "source_refs": [{"source_id": "VD-REALISER-DOSSIER", "locator": "Questionnaire general", "valid_as_of": "2026-05-29", "confidence": "high"}]
    },
    {
      "evidence_id": "EVID-COMPLETE-SITE-PLAN",
      "key": "site_plan_signed",
      "kind": "project_document",
      "title": "Signed site plan",
      "status": "present",
      "file_ref": "project://permit/site_plan_signed.pdf",
      "source_refs": [{"source_id": "VD-REALISER-DOSSIER", "locator": "Plan de situation", "valid_as_of": "2026-05-29", "confidence": "high"}]
    },
    {
      "evidence_id": "EVID-COMPLETE-PLANS",
      "key": "signed_plans",
      "kind": "project_document",
      "title": "Signed permit plans",
      "status": "present",
      "file_ref": "project://permit/signed_plans.pdf",
      "source_refs": [{"source_id": "VD-REALISER-DOSSIER", "locator": "Plans signes", "valid_as_of": "2026-05-29", "confidence": "high"}]
    },
    {
      "evidence_id": "EVID-COMPLETE-EGRID",
      "key": "egrid",
      "kind": "parcel_reference",
      "title": "Parcel EGRID reference",
      "status": "present",
      "external_ref": "CH915772367853",
      "source_refs": [{"source_id": "VD-CAMAC", "locator": "Parcelle/EGRID", "valid_as_of": "2026-05-29", "confidence": "high"}]
    },
    {
      "evidence_id": "EVID-COMPLETE-PARCEL",
      "key": "parcel_number",
      "kind": "parcel_reference",
      "title": "Parcel number reference",
      "status": "present",
      "external_ref": "10072",
      "source_refs": [{"source_id": "VD-CAMAC", "locator": "Parcelle", "valid_as_of": "2026-05-29", "confidence": "high"}]
    },
    {
      "evidence_id": "EVID-COMPLETE-OEREB",
      "key": "oereb_extract",
      "kind": "api_extract",
      "title": "Parsed RDPPF/OEREB extract",
      "status": "present",
      "file_ref": "project://evidence/oereb_parsed_CH915772367853.json",
      "source_refs": [{"source_id": "VD-CAMAC", "locator": "RDPPF/OEREB extract", "valid_as_of": "2026-05-29", "confidence": "high"}]
    },
    {
      "evidence_id": "EVID-COMPLETE-PROJECT-DESC",
      "key": "project_description",
      "kind": "project_note",
      "title": "Project description",
      "status": "present",
      "file_ref": "project://permit/project_description.md",
      "source_refs": [{"source_id": "VD-PERMIS-CONSTRUIRE", "locator": "Description du projet", "valid_as_of": "2026-05-29", "confidence": "high"}]
    },
    {
      "evidence_id": "EVID-COMPLETE-WORKS",
      "key": "works_type",
      "kind": "project_note",
      "title": "Works type",
      "status": "present",
      "file_ref": "project://permit/works_type.md",
      "source_refs": [{"source_id": "VD-PERMIS-CONSTRUIRE", "locator": "Type de travaux", "valid_as_of": "2026-05-29", "confidence": "high"}]
    },
    {
      "evidence_id": "EVID-COMPLETE-ENERGY",
      "key": "energy_form",
      "kind": "specialist_document",
      "title": "Energy form",
      "status": "present",
      "file_ref": "project://permit/energy_form.pdf",
      "source_refs": [{"source_id": "VD-ENERGY-FORMS", "locator": "Formulaire energie VD", "valid_as_of": "2026-05-29", "confidence": "high"}]
    },
    {
      "evidence_id": "EVID-COMPLETE-FIRE",
      "key": "fire_safety_note",
      "kind": "specialist_document",
      "title": "Fire-safety note",
      "status": "present",
      "file_ref": "project://permit/fire_safety_note.pdf",
      "source_refs": [{"source_id": "ECA-VAUD-FIRE-PERMIT", "locator": "Position ECA/AEAI", "valid_as_of": "2026-05-29", "confidence": "high"}]
    },
    {
      "evidence_id": "EVID-COMPLETE-SPECIAL-Q",
      "key": "special_questionnaires",
      "kind": "scope_decision",
      "title": "No special questionnaire identified in fixture scope",
      "status": "not_applicable",
      "external_ref": "fixture scope decision",
      "source_refs": [{"source_id": "VD-PERMIS-CONSTRUIRE", "locator": "Questionnaires particuliers", "valid_as_of": "2026-05-29", "confidence": "medium"}]
    },
    {
      "evidence_id": "EVID-COMPLETE-MATRIX",
      "key": "phase_constraint_matrix",
      "kind": "aedifica_report",
      "title": "Phase-aware constraint matrix",
      "status": "present",
      "file_ref": "project://constraints/mvp1_lausanne_matrix.json",
      "source_refs": [{"source_id": "MATRIX-CH-VD-LAUSANNE-MVP1", "locator": "Phase 33 handoff", "valid_as_of": "2026-05-29", "confidence": "medium"}]
    }
  ]
}
